{
  "schema_version": "epibench.claim_eligibility.v1",
  "run_id": "far_explosion_high_sensitivity_demo",
  "epibench_version": "v1.0-draft",
  "requested_claim": "E2-PI",
  "final_claim": "E1",
  "ceilings": {
    "dataset_tier": "E2-PI",
    "split_policy": "E2-PI",
    "label_audit": "E4",
    "leakage_audit": "E4",
    "threshold_policy": "E4",
    "failure_status": "E1",
    "hardware_evidence": "E4",
    "track_consistency": "E4"
  },
  "score": {
    "epi_score": 19.629,
    "axis_scores": {
      "performance": 0.92,
      "clinical_safety": 0.08,
      "robustness": 0.62,
      "stability": 0.36,
      "latency": 0.82,
      "calibration": 0.42
    },
    "floor_penalty_applied": true
  },
  "dataset_tier_evaluation": {
    "declared_tier": "T1",
    "effective_tier": "T1",
    "mts_mean": 2.833,
    "mts_item_floor": 2,
    "missing_core_mts_items": [],
    "downgraded": false
  },
  "badges": [
    "EpiBench-Dataset-T1",
    "EpiBench-Run-Complete",
    "EpiBench-Failure-Transparent",
    "EpiBench-Claim-E1",
    "EpiBench-Leakage-Checked"
  ],
  "blocking_reasons": [
    "False alarm burden exceeds blocking budget."
  ],
  "forbidden_phrases": []
}
