{
  "schema_version": "epibench.claim_eligibility.v1",
  "run_id": "leakage_high_metric_demo",
  "epibench_version": "v1.0-draft",
  "requested_claim": "E3",
  "final_claim": "E1",
  "ceilings": {
    "dataset_tier": "E2-PI",
    "split_policy": "E2-PI",
    "label_audit": "E4",
    "leakage_audit": "E1",
    "threshold_policy": "E1",
    "failure_status": "E1",
    "hardware_evidence": "E4",
    "track_consistency": "E4"
  },
  "score": {
    "epi_score": 94.727,
    "axis_scores": {
      "performance": 0.98,
      "clinical_safety": 0.95,
      "robustness": 0.92,
      "stability": 0.9,
      "latency": 0.95
    },
    "floor_penalty_applied": false
  },
  "dataset_tier_evaluation": {
    "declared_tier": "T1",
    "effective_tier": "T1",
    "mts_mean": 2.833,
    "mts_item_floor": 2,
    "missing_core_mts_items": [],
    "downgraded": false
  },
  "badges": [
    "EpiBench-Dataset-T1",
    "EpiBench-Run-Complete",
    "EpiBench-Failure-Transparent",
    "EpiBench-Claim-E1"
  ],
  "blocking_reasons": [
    "Blocking sentinel present: PATIENT_LEAKAGE.",
    "Blocking sentinel present: SPLIT_NONCOMPLIANT.",
    "Split leakage audit did not pass.",
    "Threshold selection uses test labels."
  ],
  "forbidden_phrases": []
}
